{
  "$schema": "https://json-schema.org/draft/2020-12/schema",
  "$id": "https://arab.example/schema/v1/entity.schema.json",
  "title": "Entity",
  "type": "object",
  "additionalProperties": false,
  "required": ["id", "schema_version", "country_code", "canonical_name", "canonical_name_language", "entity_type", "status", "canonical_source_id", "source_locator", "legacy_ids", "coordinates", "notes"],
  "properties": {
    "id": {"type": "string", "pattern": "^ENT-[A-Z]{2}-[A-Z0-9-]+$"},
    "schema_version": {"const": "1.0.0"},
    "country_code": {"type": "string", "pattern": "^[A-Z]{2}$"},
    "canonical_name": {"type": "string", "minLength": 1},
    "canonical_name_language": {"type": "string", "minLength": 2},
    "entity_type": {"type": "string", "minLength": 2},
    "status": {"enum": ["current", "historical", "destroyed", "displaced", "disputed", "de_facto", "claimed", "proposed", "transitional", "uncertain"]},
    "valid_from": {"type": ["string", "null"], "format": "date"},
    "valid_to": {"type": ["string", "null"], "format": "date"},
    "canonical_source_id": {"type": "string", "pattern": "^SRC-[A-Z0-9-]+$"},
    "source_locator": {"type": "string", "minLength": 1},
    "legacy_ids": {"type": "array", "items": {"type": "string"}, "uniqueItems": true},
    "coordinates": {
      "oneOf": [
        {"type": "null"},
        {
          "type": "object",
          "additionalProperties": false,
          "required": ["latitude", "longitude", "source_id"],
          "properties": {
            "latitude": {"type": "number", "minimum": -90, "maximum": 90},
            "longitude": {"type": "number", "minimum": -180, "maximum": 180},
            "source_id": {"type": "string", "pattern": "^SRC-[A-Z0-9-]+$"}
          }
        }
      ]
    },
    "notes": {"type": ["string", "null"]}
  }
}
